{
  "$schema": "https://json-schema.org/draft/2020-12/schema",
  "type": "object",
  "additionalProperties": false,
  "required": ["from_character", "to_character", "swapped_url", "media_job", "markdown"],
  "properties": {
    "from_character": {"type": "string"},
    "to_character": {"type": "string"},
    "source_url": {"type": "string"},
    "swapped_url": {"type": "string"},
    "replaced_segments": {"type": "integer"},
    "media_job": {"type": "object"},
    "markdown": {"type": "string"}
  }
}
